{
  "tarea_id": "2026-10-sugarloaf",
  "diseno": "diseno_otm",
  "corridas": 6,
  "modelo": "claude-haiku-5-5",
  "costo_usd": 0.0949,
  "por_corrida": [
    {
      "id": "N1_VV_r1",
      "perfil": {
        "nivel_edad": "S1",
        "nivel": "N1",
        "estilo": "VV"
      },
      "ruta": [
        "P1-MRS",
        "P3-MM",
        "P2-RM",
        "P3-MM",
        "P4-WM",
        "P3-MM",
        "P4-WM",
        "P5-INT",
        "P2-RM",
        "P5-INT",
        "P6-VAL",
        "P7-EXP"
      ],
      "bloqueos": [
        {
          "transicion": "B23",
          "turnos": [
            3,
            4
          ],
          "resolucion": "peer"
        },
        {
          "transicion": "B34",
          "turnos": [
            13,
            14,
            15
          ],
          "resolucion": "peer"
        }
      ],
      "supuestos": [
        "cable recto",
        "180 m es la altura del triángulo"
      ],
      "modelo": "pitágoras",
      "respuesta_final": "Giuseppe tenía que correr unos 1489 metros, o sea aproximadamente 1,5 km. Los 12 minutos de escalada no los usamos porque no cambian el triángulo.",
      "validacion": true,
      "archivo": "N1_VV_r1.json",
      "costo_usd": 0.013505
    },
    {
      "id": "N1_AA_r1",
      "perfil": {
        "nivel_edad": "S1",
        "nivel": "N1",
        "estilo": "AA"
      },
      "ruta": [
        "P1-MRS",
        "P2-RM",
        "P3-MM",
        "P4-WM",
        "P5-INT",
        "P4-WM",
        "P5-INT",
        "P6-VAL",
        "P5-INT",
        "P7-EXP",
        "P6-VAL",
        "P7-EXP",
        "P6-VAL",
        "P7-EXP"
      ],
      "bloqueos": [
        {
          "transicion": "B23",
          "turnos": [
            3,
            4,
            5
          ],
          "resolucion": "peer"
        },
        {
          "transicion": "B56",
          "turnos": [
            12,
            13,
            14,
            15,
            16,
            17,
            18,
            19
          ],
          "resolucion": "peer"
        }
      ],
      "supuestos": [
        "cable forma triángulo rectángulo",
        "cable llega hasta la cima",
        "1489 m es distancia hasta debajo de la cima",
        "12 minutos solo sirven para la escalada",
        "pie del cerro más atrás que el cable"
      ],
      "modelo": "triángulo rectángulo",
      "respuesta_final": "Con 3 min = 0,05 h, el cable recorre 30 · 0,05 = 1,5 km = 1500 m. Por Pitágoras con c = 1500 m y a = 180 m, el otro cateto es √(1500² − 180²) ≈ 1489 m, distancia hasta debajo de la cima. Aproximadamente 1,5 km; el pie del cerro podría estar un poco más atrás, pero falta el dato de la ladera para la distancia exacta. Se pregunta al profesor si basta el valor aproximado.",
      "validacion": true,
      "archivo": "N1_AA_r1.json",
      "costo_usd": 0.018047
    },
    {
      "id": "N2_VV_r1",
      "perfil": {
        "nivel_edad": "S1",
        "nivel": "N2",
        "estilo": "VV"
      },
      "ruta": [
        "P1-MRS",
        "P3-MM",
        "P2-RM",
        "P3-MM",
        "P4-WM",
        "P6-VAL",
        "P2-RM",
        "P1-MRS",
        "P2-RM",
        "P5-INT",
        "P7-EXP",
        "P5-INT",
        "P6-VAL",
        "P7-EXP"
      ],
      "bloqueos": [
        {
          "transicion": "B12",
          "turnos": [
            8,
            9,
            10,
            11,
            12,
            13,
            14,
            15,
            16,
            17
          ],
          "resolucion": "sin_resolver"
        }
      ],
      "supuestos": [
        "cable recto",
        "cable como hipotenusa del triángulo",
        "altura igual al desnivel de 180 m",
        "pie donde empieza la ladera",
        "distancia plana igual a la base del triángulo"
      ],
      "modelo": "triángulo rectángulo",
      "respuesta_final": "Giuseppe tenía que correr aproximadamente 1489 m, hasta debajo de la cima, sin contar la ladera.",
      "validacion": true,
      "archivo": "N2_VV_r1.json",
      "costo_usd": 0.015206
    },
    {
      "id": "N3_AA_r1",
      "perfil": {
        "nivel_edad": "S1",
        "nivel": "N3",
        "estilo": "AA"
      },
      "ruta": [
        "P4-WM",
        "P3-MM",
        "P4-WM",
        "P3-MM",
        "P6-VAL",
        "P1-MRS",
        "P2-RM",
        "P6-VAL",
        "P2-RM",
        "P3-MM",
        "P6-VAL",
        "P3-MM",
        "P4-WM",
        "P6-VAL",
        "P5-INT",
        "P6-VAL",
        "P5-INT",
        "P7-EXP",
        "P6-VAL",
        "P7-EXP"
      ],
      "bloqueos": [
        {
          "transicion": "B12",
          "turnos": [
            3,
            4,
            5,
            6,
            7,
            8,
            9,
            10,
            11,
            12
          ],
          "resolucion": "peer"
        },
        {
          "transicion": "B23",
          "turnos": [
            13,
            14,
            15,
            16,
            17,
            18,
            19,
            20
          ],
          "resolucion": "sin_resolver"
        },
        {
          "transicion": "B67",
          "turnos": [
            27,
            28,
            29,
            30
          ],
          "resolucion": "sin_resolver"
        }
      ],
      "supuestos": [
        "triangulo rectangulo",
        "pie al nivel de la estacion",
        "ladera y llanura llegan a la misma vertical de la cima",
        "llanura amplia implica x mayor que 0",
        "angulo de 70 grados estimado de la foto (propuesto, no aceptado)"
      ],
      "modelo": "pitagorico",
      "respuesta_final": "No hay un valor unico; solo sabemos que 0 < x < 1489 m, porque faltan el angulo de la ladera y la velocidad de escalada. La ecuacion es x = 1489 - L cos(theta).",
      "validacion": true,
      "archivo": "N3_AA_r1.json",
      "costo_usd": 0.022871
    },
    {
      "id": "N4_VV_r1",
      "perfil": {
        "nivel_edad": "S1",
        "nivel": "N4",
        "estilo": "VV"
      },
      "ruta": [
        "P3-MM",
        "P1-MRS",
        "P3-MM",
        "P2-RM",
        "P4-WM",
        "P1-MRS",
        "P2-RM",
        "P5-INT",
        "P6-VAL",
        "P7-EXP",
        "P4-WM",
        "P7-EXP",
        "P6-VAL",
        "P7-EXP"
      ],
      "bloqueos": [
        {
          "transicion": "B12",
          "turnos": [
            7,
            8,
            9,
            10
          ],
          "resolucion": "peer"
        },
        {
          "transicion": "B56",
          "turnos": [
            11,
            12,
            13,
            14,
            15,
            16
          ],
          "resolucion": "peer"
        }
      ],
      "supuestos": [
        "cable recto",
        "ladera casi vertical",
        "escalada con poco avance lateral"
      ],
      "modelo": "pitágoras",
      "respuesta_final": "La llanura mide unos 1,49 km, o un poco menos, porque la ladera avanza un poquito de lado.",
      "validacion": true,
      "archivo": "N4_VV_r1.json",
      "costo_usd": 0.014558
    },
    {
      "id": "N4_AA_r1",
      "perfil": {
        "nivel_edad": "S1",
        "nivel": "N4",
        "estilo": "AA"
      },
      "ruta": [
        "P3-MM",
        "P4-WM",
        "P5-INT",
        "P3-MM",
        "P5-INT",
        "P6-VAL",
        "P5-INT",
        "P6-VAL",
        "P7-EXP"
      ],
      "bloqueos": [
        {
          "transicion": "B56",
          "turnos": [
            5,
            6,
            7,
            8
          ],
          "resolucion": "peer"
        }
      ],
      "supuestos": [
        "estacion a la altura del pie del cerro",
        "ladera muy empinada, tramo horizontal de subida chico",
        "parte horizontal de la subida d mayor que cero"
      ],
      "modelo": "pitagorico",
      "respuesta_final": "La llanura es x = raiz(1500^2 - 180^2) - d, approximately 1489 m - d, so the distance is como maximo 1,49 km, with d the horizontal part of the climb.",
      "validacion": true,
      "archivo": "N4_AA_r1.json",
      "costo_usd": 0.010669
    }
  ],
  "agregado": {
    "pct_bloqueo_por_transicion": {
      "B12": 0.5,
      "B23": 0.5,
      "B34": 0.17,
      "B56": 0.5,
      "B67": 0.17
    },
    "modelos_observados": {
      "pitágoras": 2,
      "triángulo rectángulo": 2,
      "pitagorico": 2
    },
    "pct_validan": 1.0
  },
  "fecha": "2026-10-20T19:59:26Z"
}