{
  "tarea_id": "2026-10-anticipo-renta-vitalicia",
  "diseno": "diseno_otm",
  "corridas": 6,
  "modelo": "claude-sonnet-5-5",
  "costo_usd": 1.5962,
  "por_corrida": [
    {
      "id": "N1_VV_r1",
      "perfil": {
        "nivel_edad": "U",
        "nivel": "N1",
        "estilo": "VV"
      },
      "ruta": [
        "P1-MRS",
        "P2-RM",
        "P1-MRS",
        "P2-RM",
        "P3-MM",
        "P6-VAL",
        "P2-RM",
        "P3-MM",
        "P6-VAL",
        "P2-RM",
        "P3-MM",
        "P2-RM",
        "P5-INT",
        "P4-WM",
        "P3-MM",
        "P2-RM",
        "P4-WM"
      ],
      "bloqueos": [
        {
          "transicion": "B23",
          "turnos": [
            14,
            15
          ],
          "resolucion": "peer"
        }
      ],
      "supuestos": [
        "10% del total que recibirá en la vida",
        "pensión de 100 mil mensuales",
        "vive 20 años (240 meses)",
        "descuento mensual fijo",
        "probabilidad de seguir viva baja linealmente de 1 a 0 en 240 meses",
        "interés mensual constante de 0,3% (y 0,6% como alternativa)",
        "aproximación por tramos de 30 meses con el mes del medio"
      ],
      "modelo": "valor actuarial",
      "respuesta_final": "No hay exposición final explícita. El par plantea como regla que el valor esperado descontado de los descuentos (cada descuento multiplicado por la probabilidad de seguir viva y por 1/(1+i)^mes) iguale el anticipo de 2,4 millones; fijando el descuento se despeja el plazo. Sin interés, 25.000 durante unos 135 meses calza; con interés de 0,3% mensual el plazo se alarga hasta casi los 240 meses, y cuestionan si no es mucho cobrar 25 mil casi toda la vida.",
      "validacion": true,
      "archivo": "N1_VV_r1.json",
      "costo_usd": 0.34948
    },
    {
      "id": "N1_AA_r1",
      "perfil": {
        "nivel_edad": "U",
        "nivel": "N1",
        "estilo": "AA"
      },
      "ruta": [
        "P1-MRS",
        "P2-RM",
        "P3-MM",
        "P4-WM",
        "P3-MM",
        "P2-RM",
        "P3-MM",
        "P2-RM",
        "P4-WM",
        "P6-VAL",
        "P4-WM",
        "P7-EXP"
      ],
      "bloqueos": [
        {
          "transicion": "B12",
          "turnos": [
            1,
            2,
            3
          ],
          "resolucion": "self"
        }
      ],
      "supuestos": [
        "anticipo = 10% de la pensión mensual",
        "descuento constante x durante n meses",
        "plazo n = 12 meses (y luego 60)",
        "persona de 65 años",
        "tasa de interés mensual constante de 0,3%",
        "p_k = 1 (nadie muere) en el cálculo de prueba",
        "supervivencia según tabla de mortalidad"
      ],
      "modelo": "valor actuarial",
      "respuesta_final": "Regla: x = 0,1·P / Σ[p_k/(1+i)^k], con k de 1 a n, donde p_k es la probabilidad de seguir vivo en el mes k e i la tasa mensual. Piden la tabla de mortalidad, la tasa y el n máximo; la firmeza se estudia recalculando x con distintas tablas, tasas y plazos. Con p_k = 1, i = 0,3% y n = 12, x ≈ 0,0085·P, que sería el mínimo.",
      "validacion": true,
      "archivo": "N1_AA_r1.json",
      "costo_usd": 0.17858
    },
    {
      "id": "N2_VV_r1",
      "perfil": {
        "nivel_edad": "U",
        "nivel": "N2",
        "estilo": "VV"
      },
      "ruta": [
        "P1-MRS",
        "P2-RM",
        "P3-MM",
        "P2-RM",
        "P4-WM",
        "P3-MM",
        "P4-WM",
        "P6-VAL",
        "P3-MM",
        "P4-WM",
        "P6-VAL",
        "P3-MM",
        "P5-INT",
        "P3-MM",
        "P6-VAL",
        "P4-WM",
        "P6-VAL",
        "P5-INT"
      ],
      "bloqueos": [],
      "supuestos": [
        "10% del valor total de la renta",
        "horizonte de vida fijo de 20 años (esperanza de vida)",
        "pensión de 500 mil",
        "tasa de interés constante (2%, 3%, 5% anual)",
        "descuento mensual constante durante el plazo",
        "compensación en promedio sobre muchas personas",
        "plazos de 5, 10 y 15 años",
        "tope de baja de 15% de la pensión"
      ],
      "modelo": "valor presente (anualidad)",
      "respuesta_final": "Regla propuesta: baja mensual = 10%·(valor de hoy de la renta completa)/(valor de hoy de las cuotas de n años), idealmente ponderando ambas por la probabilidad de estar vivo (tabla de mortalidad pedida pero no usada en los cálculos). Con pensión de 500 mil, vida de 20 años y 3% anual: anticipo ≈ 9 millones; baja ≈ 162 mil a 5 años, ≈ 87 mil a 10 años (pensión ≈ 413 mil) y ≈ 62 mil a 15 años. La regla es firme frente a la tasa (de 3% a 5% cambia unos 7 mil), pero muy sensible al plazo, que es una decisión; con un tope de 15% de baja (75 mil) el plazo mínimo quedaría entre 10 y 15 años.",
      "validacion": true,
      "archivo": "N2_VV_r1.json",
      "costo_usd": 0.402744
    },
    {
      "id": "N3_AA_r1",
      "perfil": {
        "nivel_edad": "U",
        "nivel": "N3",
        "estilo": "AA"
      },
      "ruta": [
        "P1-MRS",
        "P2-RM",
        "P3-MM",
        "P5-INT",
        "P2-RM",
        "P4-WM",
        "P3-MM",
        "P6-VAL",
        "P4-WM",
        "P6-VAL",
        "P3-MM",
        "P5-INT",
        "P2-RM",
        "P4-WM",
        "P6-VAL",
        "P4-WM",
        "P6-VAL",
        "P5-INT",
        "P6-VAL",
        "P7-EXP"
      ],
      "bloqueos": [
        {
          "transicion": "B34",
          "turnos": [
            10,
            11,
            12
          ],
          "resolucion": "peer"
        }
      ],
      "supuestos": [
        "10% del valor total esperado de la renta",
        "descuento d constante durante n meses",
        "tasa de descuento constante (v = 0,997 y 0,995)",
        "renta dura unos 20 años (VP ≈ 200·P)",
        "tope del descuento d ≤ 0,2·P",
        "supervivencia lineal p_k = 1 − k/240 (todos mueren a los 20 años)",
        "aproximación continua v^k ≈ e^(−ak)"
      ],
      "modelo": "valor actuarial",
      "respuesta_final": "Bajar la pensión en un monto d durante n meses de modo que d·S_n = 0,1·P·S_∞, con S_n = Σ v^k·p_k, y con d ≤ 0,2·P. Con supervivencia supuesta p_k = 1 − k/240, n da unos 70, 60 y 53 meses para tasas mensuales de 0%, 0,3% y 0,5%; la regla es poco firme porque depende de la tasa y de la tabla de mortalidad, y hay que recalcular con datos reales.",
      "validacion": true,
      "archivo": "N3_AA_r1.json",
      "costo_usd": 0.292444
    },
    {
      "id": "N4_VV_r1",
      "perfil": {
        "nivel_edad": "U",
        "nivel": "N4",
        "estilo": "VV"
      },
      "ruta": [
        "P1-MRS",
        "P3-MM",
        "P2-RM",
        "P4-WM",
        "P5-INT",
        "P6-VAL",
        "P2-RM",
        "P4-WM",
        "P7-EXP",
        "P6-VAL"
      ],
      "bloqueos": [],
      "supuestos": [
        "renta mensual de 1.000.000",
        "anticipo = 10% de la renta mensual (100.000)",
        "tasa de descuento constante de 0,3% mensual",
        "descuento mensual d constante durante n meses",
        "sobrevida casi 1 (p_t ≈ 0,99) en 12 meses",
        "persona de 65 años",
        "88% vivo a los 10 años (p promedio ≈ 0,94), sin tabla real",
        "total pagado no mayor que anticipo más interés de un crédito de consumo",
        "plazo corto de 12 meses"
      ],
      "modelo": "valor actual esperado",
      "respuesta_final": "Anticipo del 10% (tomado como 10% de una renta mensual de 1.000.000, es decir 100.000). Regla: d = anticipo / Σ_{t=1}^{n} p_t/(1+i)^t, con n = 12 meses, lo que da d ≈ 8.500 al mes (≈0,85% de la pensión), y con la condición de que el total pagado no supere el anticipo más el interés de un crédito de consumo. La regla es firme a 12 meses (casi no dependen de i ni p), pero para plazos largos depende bastante de la tasa y de la mortalidad; vale para una persona de 65 años con i ≈ 0,3% mensual y habría que recalcular para edades mayores.",
      "validacion": true,
      "archivo": "N4_VV_r1.json",
      "costo_usd": 0.209352
    },
    {
      "id": "N4_AA_r1",
      "perfil": {
        "nivel_edad": "U",
        "nivel": "N4",
        "estilo": "AA"
      },
      "ruta": [
        "P3-MM",
        "P2-RM",
        "P3-MM",
        "P2-RM",
        "P4-WM",
        "P6-VAL",
        "P4-WM",
        "P7-EXP",
        "P6-VAL"
      ],
      "bloqueos": [],
      "supuestos": [
        "anticipo = 10% del valor presente de la renta vitalicia",
        "tasa de interés constante (3% y 5%)",
        "supervivencia anual constante p (0,96 y 0,98)",
        "descuento d constante durante n años",
        "tope propio d ≤ 20% de la pensión",
        "tabla de pensionados (viven más que la población general)",
        "la persona no debe quedar sin pensión (d < R)"
      ],
      "modelo": "actuarial geométrico",
      "respuesta_final": "Regla: d = 0,1·R/(1−qⁿ), con q = p/(1+i), y n elegido de modo que d ≤ 0,2R (tope propio, no normativo). Con p = 0,98 y n = 10 años, el descuento es cerca de 25% de la pensión con i = 3% y 20% con i = 5%. La regla es sensible a la tasa, a la tabla de mortalidad del pensionado y a interpretar el anticipo como 10% del valor presente de la renta; con p constante es solo una aproximación.",
      "validacion": true,
      "archivo": "N4_AA_r1.json",
      "costo_usd": 0.163576
    }
  ],
  "agregado": {
    "pct_bloqueo_por_transicion": {
      "B12": 0.17,
      "B23": 0.17,
      "B34": 0.17
    },
    "modelos_observados": {
      "valor actuarial": 3,
      "valor presente (anualidad)": 1,
      "valor actual esperado": 1,
      "actuarial geométrico": 1
    },
    "pct_validan": 1.0
  },
  "fecha": "2026-10-20T21:10:59Z"
}